{
  "schema": "ResidualOps_PilotLinkPack/v0.1",
  "generated_at": "2026-05-30T00:53:28.335251+00:00",
  "links": {
    "github_repo": "https://github.com/Isometric-Architect/ai-objective-index",
    "pypi_package": "https://pypi.org/project/ai-objective-index/0.3.0a1/",
    "hugging_face_space": "https://huggingface.co/spaces/edict-lab/ai-objective-index-demo",
    "hugging_face_dataset": "https://huggingface.co/datasets/edict-lab/ai-objective-index-sample",
    "external_share_pack_local_path": "external_share_pack/README_EXTERNAL_SAFE_DEMO.md",
    "dashboard_local_path": "pilot_dashboard/RESIDUALOPS_PILOT_DASHBOARD.html",
    "portfolio_readout_local_path": "pilot_receipts/portfolio/RESIDUALOPS_PORTFOLIO_REVIEWER_READOUT.md",
    "feedback_form_template_path": "pilot_outreach/PILOT_FEEDBACK_INTAKE_FORM_TEMPLATE.md",
    "mcp_registry_entry": "TODO: MCP Registry submission is not completed."
  },
  "uses_todo_for_unknown": true,
  "auto_post_performed": false,
  "external_api_used": false
}
